{
    "schemaVersion":  1,
    "handoffId":  "handoff-align-amp-phase-entry-20260731",
    "workItemId":  "wi-20260731-0001",
    "expectedWorkItemVersion":  1,
    "clientId":  "align-hcm",
    "workerRole":  "bounded-worker",
    "status":  "partially_completed",
    "startedAt":  "2026-07-31T13:50:55.5994807+00:00",
    "finishedAt":  "2026-07-31T13:58:12.3895509+00:00",
    "summary":  "Completed the read-only audit phase and prepared client-scoped evidence for canonical in-progress reconciliation before final verification.",
    "artifacts":  [
                      "clients/align-hcm/evidence/2026-07-31-amp-issue-readonly-verification.json",
                      "clients/align-hcm/deliverables/2026-07-31-amp-issue-remediation-brief.md"
                  ],
    "evidence":  [
                     "agent-os-run:20260730-101244-5fb934cf/task.json",
                     "clients/align-hcm/evidence/2026-07-31-amp-issue-readonly-verification.json",
                     "state/execution-graphs/wi-20260731-0001/mgr-align-amp-review-20260731/execution-graph.json",
                     "sha256:0CA1F9889242A6E69D5B7E6F00D075FE0BB1E779ECF57ECAB9237744E687D36B"
                 ],
    "verification":  [
                         "All sitemap-listed normal URLs passed the bounded availability check.",
                         "A current AMP article variant passed an independent public readback.",
                         "No external action or worker canonical write occurred."
                     ],
    "assumptions":  [

                    ],
    "risks":  [
                  "The exact affected article is unavailable until the authorized Search Console report is opened."
              ],
    "privacy":  "redacted",
    "containsSecrets":  false,
    "containsDirectIdentifiers":  false,
    "containsRawCommunications":  false,
    "approvalGate":  "none",
    "proposedTransition":  "in_progress",
    "canonicalWriteAttempted":  false,
    "externalActionAttempted":  false
}
