{
  "schemaVersion": 1,
  "handoffId": "ai-tech-pilots-done-20260721",
  "workItemId": "wi-20260721-0002",
  "expectedWorkItemVersion": 3,
  "clientId": "momentum-360",
  "workerRole": "web-pilot-qa-verifier",
  "status": "completed",
  "startedAt": "2026-07-21T18:02:00Z",
  "finishedAt": "2026-07-21T18:04:00Z",
  "summary": "The AI Tech News next-step packet is complete with live links, current QA, owners, decision questions, calendar options, and a concise unsent response.",
  "artifacts": ["clients/momentum-360/deliverables/2026-07-21-ai-tech-news-follow-up.md"],
  "evidence": ["clients/momentum-360/deliverables/2026-07-21-ai-tech-news-follow-up.md"],
  "verification": ["The review hub is not represented as a replacement for separate client links.", "Google Maps-first sourcing direction is preserved.", "No public release, deployment, Slack message, or calendar event occurred."],
  "assumptions": [],
  "risks": [],
  "privacy": "redacted",
  "containsSecrets": false,
  "containsDirectIdentifiers": false,
  "containsRawCommunications": false,
  "approvalGate": "none",
  "proposedTransition": "done",
  "canonicalWriteAttempted": false,
  "externalActionAttempted": false
}
