{
  "schemaVersion": 1,
  "handoffId": "ai-tech-pilots-verify-20260721",
  "workItemId": "wi-20260721-0002",
  "expectedWorkItemVersion": 2,
  "clientId": "momentum-360",
  "workerRole": "web-pilot-qa-builder",
  "status": "completed",
  "startedAt": "2026-07-21T17:56:00Z",
  "finishedAt": "2026-07-21T18:02:00Z",
  "summary": "The three live pilot sites passed desktop and mobile checks and now have explicit owners, review questions, proposed check-in times, and an unsent Slack response.",
  "artifacts": ["clients/momentum-360/deliverables/2026-07-21-ai-tech-news-follow-up.md"],
  "evidence": ["clients/momentum-360/deliverables/2026-07-21-ai-tech-news-follow-up.md"],
  "verification": ["All three live sites loaded.", "Desktop and narrow mobile layouts showed no horizontal overflow.", "No browser console errors were observed.", "Each page has a title, H1, and link inventory.", "Dillon and Mac calendar availability was checked without creating an event."],
  "assumptions": [],
  "risks": ["Melissa and Sean calendar availability could not be verified through the connected calendar."],
  "privacy": "redacted",
  "containsSecrets": false,
  "containsDirectIdentifiers": false,
  "containsRawCommunications": false,
  "approvalGate": "none",
  "proposedTransition": "verification",
  "canonicalWriteAttempted": false,
  "externalActionAttempted": false
}
