{
  "schemaVersion": 1,
  "handoffId": "reporting-os-maps-deferred-20260717",
  "workItemId": "wi-20260717-0003",
  "expectedWorkItemVersion": 1,
  "clientId": "momentum-360",
  "workerRole": "marketing-operations",
  "status": "blocked",
  "startedAt": "2026-07-17T02:31:00Z",
  "finishedAt": "2026-07-17T02:32:00Z",
  "summary": "Google Maps prospect verification is not a Reporting OS provider requirement. It is deferred here and rerouted upstream into the approval-gated Jesse prospect workflow.",
  "artifacts": [
    "clients/momentum-360/deliverables/2026-07-16-jesse-prospect-automation-gap-and-execution-package.md"
  ],
  "evidence": [
    "clients/momentum-360/deliverables/2026-07-16-jesse-prospect-automation-gap-and-execution-package.md"
  ],
  "verification": [
    "The canonical gap package places Maps verification before prospect-site drafting and outreach approval.",
    "No Reporting OS credential, account, or production environment was changed."
  ],
  "assumptions": [],
  "risks": [
    "Live Maps retrieval remains disabled until an authorized research path is selected."
  ],
  "privacy": "redacted",
  "containsSecrets": false,
  "containsDirectIdentifiers": false,
  "containsRawCommunications": false,
  "approvalGate": "explicit",
  "proposedTransition": "deferred",
  "canonicalWriteAttempted": false,
  "externalActionAttempted": false
}
