{
    "schemaVersion":  1,
    "handoffId":  "handoff-align-search-baseline-done-r2-20260802",
    "workItemId":  "wi-20260802-0001",
    "expectedWorkItemVersion":  3,
    "clientId":  "align-hcm",
    "workerRole":  "bounded-worker",
    "status":  "completed",
    "startedAt":  "2026-08-02T16:55:09.0987749+00:00",
    "finishedAt":  "2026-08-02T17:00:11.7929052+00:00",
    "summary":  "Independent verification episode confirmed the Align HCM Google Search traffic monitoring baseline meets every definition-of-done check: exact active route and canonical site availability re-verified, dated aggregate evidence inventory matches sources, verified metrics remain separated from unavailable Search Console and GA4 fields, and no account, analytics, website, external-delivery, or worker canonical mutation occurred.",
    "artifacts":  [
                      "clients/align-hcm/deliverables/2026-08-02-google-search-traffic-monitoring-baseline.md"
                  ],
    "evidence":  [
                     "agent-os-run:20260802-011238-f19758b7/task.json",
                     "clients/align-hcm/deliverables/2026-07-30-ytd-attribution-report/ytd-company-attribution.json",
                     "clients/align-hcm/attribution/2026-07-18-weekend-attribution-knowledge-session.md",
                     "clients/align-hcm/github/align-hcm-lead-intelligence/reports/latest-hubspot-kpi-report.md",
                     "state/execution-graphs/wi-20260802-0001/mgr-20260802t165200z-wi-20260802-0001-searchdone/execution-graph.json",
                     "sha256:C157F20103F6BF2AABCCF685323BB24B02C364C7DF42F7577B94C91552EEEE09"
                 ],
    "verification":  [
                         "Exact active Align route and canonical website re-verified with fresh read-only availability checks.",
                         "Baseline figures match the dated aggregate HubSpot attribution snapshot and documented source limitations.",
                         "Verified metrics remain distinct from unavailable Search Console and GA4 fields with no estimation.",
                         "No account, website, analytics, external-delivery, or worker canonical mutation occurred."
                     ],
    "assumptions":  [

                    ],
    "risks":  [
                  "Search Console and GA4 traffic trends remain unavailable until exact authorized read-only properties are mapped."
              ],
    "privacy":  "redacted",
    "containsSecrets":  false,
    "containsDirectIdentifiers":  false,
    "containsRawCommunications":  false,
    "approvalGate":  "none",
    "proposedTransition":  "done",
    "canonicalWriteAttempted":  false,
    "externalActionAttempted":  false
}
