{
  "schemaVersion": 1,
  "handoffId": "prospect-draft-automation-done-20260717",
  "workItemId": "wi-20260717-0001",
  "expectedWorkItemVersion": 3,
  "clientId": "momentum-360",
  "workerRole": "verification-owner",
  "status": "completed",
  "startedAt": "2026-07-17T01:34:00Z",
  "finishedAt": "2026-07-17T01:35:00Z",
  "summary": "The approval-gated prospect website draft automation is locally complete and verified. Delivery remains a separate explicitly approved action.",
  "artifacts": [
    "clients/momentum-360/deliverables/2026-07-16-prospect-email-automation-status.md"
  ],
  "evidence": [
    "clients/momentum-360/deliverables/2026-07-16-prospect-email-automation-status.md"
  ],
  "verification": [
    "The compiler is deterministic and idempotent.",
    "The first-pilot cap is enforced at two records.",
    "No delivery mechanism or network client is present.",
    "The canonical artifact records all current approval blockers."
  ],
  "assumptions": [],
  "risks": [
    "No prospect may be contacted until exact records and delivery are approved."
  ],
  "privacy": "redacted",
  "containsSecrets": false,
  "containsDirectIdentifiers": false,
  "containsRawCommunications": false,
  "approvalGate": "none",
  "proposedTransition": "done",
  "canonicalWriteAttempted": false,
  "externalActionAttempted": false
}
