{"schemaVersion":1,"handoffId":"revive-blogs-verification-20260717","workItemId":"wi-20260717-0006","expectedWorkItemVersion":2,"clientId":"revive-systems","workerRole":"content-builder","status":"completed","startedAt":"2026-07-17T02:39:00Z","finishedAt":"2026-07-17T02:40:00Z","summary":"The five-blog package passed the local completeness review and excludes the deferred sitemap task.","artifacts":["clients/revive-systems/deliverables/2026-07-16-aeo-geo-seo-blog-cluster/01-completion-manifest.md"],"evidence":["clients/revive-systems/deliverables/2026-07-16-aeo-geo-seo-blog-cluster/01-completion-manifest.md"],"verification":["Five complete HTML drafts are present.","Five nonempty PDF review files are present.","Drafts contain FAQs, citations, calls to action, and scope language.","Sitemap work is explicitly deferred."],"assumptions":[],"risks":[],"privacy":"redacted","containsSecrets":false,"containsDirectIdentifiers":false,"containsRawCommunications":false,"approvalGate":"none","proposedTransition":"verification","canonicalWriteAttempted":false,"externalActionAttempted":false}
