{
  "schemaVersion": 1,
  "handoffId": "kjb-conversion-reconcile-start-20260721",
  "workItemId": "wi-20260721-0001",
  "expectedWorkItemVersion": 2,
  "clientId": "kimberly-james-bridal",
  "workerRole": "paid-media-evidence-reconciler",
  "status": "partially_completed",
  "startedAt": "2026-07-21T17:45:00Z",
  "finishedAt": "2026-07-21T17:46:00Z",
  "summary": "Started current read-only reconciliation across the exact KJB Google Ads, Meta Ads, landing page, and first-party request record.",
  "artifacts": [],
  "evidence": ["clients/kimberly-james-bridal/evidence/2026-07-21-slack-intake-review.md"],
  "verification": ["Exact client routes were selected and no platform settings were changed."],
  "assumptions": [],
  "risks": [],
  "privacy": "redacted",
  "containsSecrets": false,
  "containsDirectIdentifiers": false,
  "containsRawCommunications": false,
  "approvalGate": "none",
  "proposedTransition": "in_progress",
  "canonicalWriteAttempted": false,
  "externalActionAttempted": false
}
