{
  "schemaVersion": 1,
  "handoffId": "prospect-draft-automation-verification-20260717",
  "workItemId": "wi-20260717-0001",
  "expectedWorkItemVersion": 2,
  "clientId": "momentum-360",
  "workerRole": "automation-builder",
  "status": "completed",
  "startedAt": "2026-07-17T01:33:00Z",
  "finishedAt": "2026-07-17T01:34:00Z",
  "summary": "The compiler processed all staged pilot records locally and preserved every approval gate.",
  "artifacts": [
    "clients/momentum-360/deliverables/2026-07-16-prospect-email-automation-status.md"
  ],
  "evidence": [
    "clients/momentum-360/deliverables/2026-07-16-prospect-email-automation-status.md"
  ],
  "verification": [
    "Two unit tests passed.",
    "Seven records produced blocked drafts with zero network calls.",
    "Every generated payload reports sending disabled."
  ],
  "assumptions": [],
  "risks": [
    "Exact recipient verification and delivery approval remain outside this local completion."
  ],
  "privacy": "redacted",
  "containsSecrets": false,
  "containsDirectIdentifiers": false,
  "containsRawCommunications": false,
  "approvalGate": "none",
  "proposedTransition": "verification",
  "canonicalWriteAttempted": false,
  "externalActionAttempted": false
}
