{
  "schemaVersion": 1,
  "handoffId": "align-dayforce-done-20260719",
  "workItemId": "wi-20260718-0005",
  "expectedWorkItemVersion": 3,
  "clientId": "align-hcm",
  "workerRole": "local-artifact-builder-verifier",
  "status": "completed",
  "startedAt": "2026-07-19T19:06:00Z",
  "finishedAt": "2026-07-19T19:11:00Z",
  "summary": "Completed local Align Dayforce Discover exhibitor readiness packet with deadline and decision fields.",
  "artifacts": ["clients/align-hcm/deliverables/2026-07-19-dayforce-discover-exhibitor-readiness-packet.md"],
  "evidence": ["clients/align-hcm/deliverables/2026-07-17-communication-open-loops-review.md"],
  "verification": ["No purchase, artwork submit, or account change attempted."],
  "assumptions": [],
  "risks": ["Tier and owners still require human confirmation before discount deadline."],
  "privacy": "redacted",
  "containsSecrets": false,
  "containsDirectIdentifiers": false,
  "containsRawCommunications": false,
  "approvalGate": "none",
  "proposedTransition": "done",
  "canonicalWriteAttempted": false,
  "externalActionAttempted": false
}
