{
  "schemaVersion": 1,
  "handoffId": "momentum-july20-ai-review-packet-20260719",
  "workItemId": "wi-20260718-0002",
  "expectedWorkItemVersion": 3,
  "clientId": "momentum-360",
  "workerRole": "local-artifact-builder-verifier",
  "status": "completed",
  "startedAt": "2026-07-19T18:40:00Z",
  "finishedAt": "2026-07-19T18:50:00Z",
  "summary": "Built a redacted local July 20 Momentum AI review decision packet covering completed work, Orbit and Maps-first pilot decisions, caller-response approval boundaries, pilot checklist, and meeting capture fields.",
  "artifacts": [
    "clients/momentum-360/deliverables/2026-07-19-july-20-ai-review-decision-packet.md"
  ],
  "evidence": [
    "clients/momentum-360/deliverables/2026-07-17-communication-open-loops-review.md",
    "clients/momentum-360/deliverables/2026-07-17-callrail-hubspot-auto-response-open-loop.md",
    "clients/momentum-360/deliverables/2026-07-16-jesse-prospect-automation-gap-and-execution-package.md"
  ],
  "verification": [
    "Packet reconciles Orbit, Maps-first, HubSpot agent, CallRail follow-up, pilot boundaries, and approval gates against current open-loop artifacts.",
    "Caller-response work remains separated as approval-gated decisions with no implementation claimed.",
    "First pilot path stays capped and local-only until named approval.",
    "Artifact contains no secrets, direct personal contact payloads, or raw message bodies.",
    "No email, Slack, CRM, CallRail, ad, or deploy action was attempted."
  ],
  "assumptions": [
    "The July 20 3 PM Eastern meeting time from the communication review remains current unless Dillon records a change."
  ],
  "risks": [
    "Sean or Jason may introduce new constraints in the meeting that require a revised packet.",
    "Caller-response implementation remains blocked until explicit approval on trigger, copy, accounts, and rollback."
  ],
  "privacy": "redacted",
  "containsSecrets": false,
  "containsDirectIdentifiers": false,
  "containsRawCommunications": false,
  "approvalGate": "none",
  "proposedTransition": "done",
  "canonicalWriteAttempted": false,
  "externalActionAttempted": false
}